檔名,中文,客語漢字,客語拼音,標籤,備註
DF205J2067_001.wav,端午節要吃粽子,五月節愛食粽,ng31 ngied54 zied21 oi53 shid54 zung53,,食 :發音人讀音shib54，正確讀音為shid54
DF205J2067_002.wav,感冒要戴口罩,寒著愛戴嘴揞,hon113 do31 oi33 dai53 zhoi53 em33,,
DF205J2067_003.wav,你哪裡不舒服,你哪位毋鬆爽,hn113 ne53 vui53 m113 sung33 song31,,
DF205J2067_004.wav,你的手機幾號,若手機幾多號,ngia33 shiu31 gi33 gid21 do33 ho53,,
DF205J2067_005.wav,你的功課作好了沒,若功課做好吂,ngia33 gung33 ko53 zo53 ho31 mang113,,
DF205J2067_006.wav,我會小心一點,𠊎會細義兜,ngai113 voi53 se53 ngi53 deu35,,
DF205J2067_007.wav,很高興認識你,當歡喜認識你,dong33 fan33 hi31 ngin53 shid21 hn113,,認 :發音人讀音ngim53，正確讀音為ngin53
DF205J2067_008.wav,實在很難相信,實在還難相信,shid54 cai53 han113 nan113 siong33 sin53,,難 :發音人讀音nam113，正確讀音為nan113
DF205J2067_009.wav,這個想法很好,這個想法已好,lia31 gai53 siong31 fab21 i53 ho31,,"法 :發音人讀音為fad21，正確讀音為fab21
已 :發音人讀音rhi53，正確讀音為i53"
DF205J2067_010.wav,謝謝你的照顧,勞瀝若个照顧,lo113 lad54 ngia33 gai33 zheu53 gu53,,瀝 :發音人讀音lag54，正確讀音為led54
DF205J2067_011.wav,可以嗎不可以,使得無使毋得,sii31 ded21 mo113 sii31 m113 ded21,,
DF205J2067_012.wav,你會不會沒問題,你曉無無問題,hn113 hiau31 mo113 mo113 mun53 ti113,,問 :發音人讀音vun53，正確讀音為mun53
DF205J2067_013.wav,我很愛吃青菜,𠊎已好食青菜,ngai113 i53 hau53 shid54 ciang33 coi53,,已 :發音人讀音rhi53，正確讀音為i53
DF205J2067_014.wav,我想學做麵包,𠊎想學做麵包,ngai113 siong31 hog54 zo53 mien53 bau33,,
DF205J2067_015.wav,你要喝什麼飲料,你愛食麼个飲料,hn113 oi33 shid54 ma31 gai33 rhim31 liau53,,
DF205J2067_016.wav,叔叔不習慣穿西裝,阿叔毋慣著西裝,a33 shug21 m113 guan53 zhog21 si33 zong33,,
DF205J2067_017.wav,這皮包是誰的,這皮包係麼人个,lia31 pi113 bau33 he53 me31 ngin113 gai33,,
DF205J2067_018.wav,這雙鞋不太合腳,這雙鞋無幾合腳,lia31 sung33 he113 mo113 gid21 hab54 giog21,,"這 :發音人讀音liad21，正確讀音為lia31
幾 :發音人讀音gi31，正確讀音為gid21
合 :發音人讀音hag54，正確讀音為hab54"
DF205J2067_019.wav,台灣不時有地震,臺灣不時有地動,toi113 van113 bud21 shi113 rhiu33 ti53 tung33,,
DF205J2067_020.wav,這裡的民宿很漂亮,這位个民宿當靚,lia31 vui53 gai33 min113 siug21 dong33 ziang33,,
DF205J2067_021.wav,這裡禁止吸菸,這位使毋得食菸,lia31 vui53 sii31 m113 ded21 shid54 rhen33,,食 :發音人讀音shib54，正確讀音為shid54
DF205J2067_022.wav,上課不要打瞌睡,上課毋好啄目睡,shong53 ko53 m113 ho31 dug21 mug21 shoi53,,
DF205J2067_023.wav,今天天氣很好,今晡日天時已好,gim33 bi33 ngid21 tien33 shi113 i53 ho31,,已 :發音人讀音rhi53，正確讀音為i53
DF205J2067_024.wav,昨天忙了整天,昨晡日無閒歸日,ca113 bi33 ngid21 mo113 han113 gui33 ngid21,,
DF205J2067_025.wav,天氣變得很涼爽,天時變到已涼爽,tien33 shi113 bien53 do53 i53 liong113 song31,,已 :發音人讀音rhi53，正確讀音為i53
DF205J2067_026.wav,明天早上再聯絡,天光朝晨正聯絡,tien33 gong35 zheu33 shun113 zhang33 lien113 log54,,
DF205J2067_027.wav,妹妹背書包去上學,老妹揹書包去學校,lo31 moi53 ba113 shu33 bau33 ki53 hog54 gau31,,去 :發音人讀音為hi33，教育部辭典拼音為ki33，平常的確常有人會使用hi33的音
DF205J2067_028.wav,妹妹很喜歡吃蘿蔔糕,阿妹當好食菜頭粄,a33 moi53 dong33 hau53 shid54 coi53 teu113 ban31,,食 :發音人讀音shib54，正確讀音為shid54
DF205J2067_029.wav,爸爸要去申請護照,阿爸愛去申請護照,a33 ba33 oi33 ki53 shin33 ciang31 fu53 zheu53,,
DF205J2067_030.wav,慢慢走不用急,定定行毋使趕緊,tin53 tin53 hang113 m113 sii31 guan31 gin31,,
DF205J2067_031.wav,冬天北部經常下雨,寒天北部長在落雨,hon113 tien33 bed21 pu53 chong113 cai53 log54 rhi31,,
DF205J2067_032.wav,別為了這個喪氣,毋好為著這來失志,m113 ho31 vui53 do31 lia31 loi113 shid21 zhi53,,失 :發音人讀音shib21，正確讀音為shid21
DF205J2067_033.wav,是誰打來的電話,係麼人打來个電話,he33 me31 ngin113 da31 loi113 gai33 tien53 fa53,,
DF205J2067_034.wav,垃圾要做資源回收,垃圾愛做資源回收,la31 sab21 oi33 zo53 zii33 ngien113 fui113 shiu33,,源 :發音人讀音rhen113，正確讀音為ngien113
DF205J2067_035.wav,請問需要什麼服務,請問需要麼个服務,ciang31 mun53 si33 rheu53 ma31 gai33 fug54 mu53,,
DF205J2067_036.wav,恭喜發財新年快樂,恭喜發財新年快樂,giung33 hi31 fad21 cai113 sin33 ngien113 kuai53 log54,,新 :發音人讀音sim33，正確讀音為sin33
DF205J2067_037.wav,我愛你他生氣了,𠊎愛你佢起譴咧,ngai113 oi53 hn113 gi113 ki31 kien31 le33,,
DF205J2067_038.wav,今天的菜口味如何,今晡日个菜口味仰脣,gim33 bi33 ngid21 gai33 coi53 kieu31 mui53 ngiong31 shun113,,
DF205J2067_039.wav,請不要在車裡吃東西,請毋好在車肚食東西,ciang31 m113 ho31 to33 cha33 du31 shid54 dung33 si33,,食 :發音人讀音shib54，正確讀音為shid54
DF205J2067_040.wav,學生要穿制服去學校,學生愛著制服去學校,hog54 sang33 oi33 zhog21 zhi53 fug54 ki53 hog54 gau31,,"服 :發音人讀音fud54，正確讀音為fug54
去 :發音人讀音為hi33，教育部辭典拼音為ki33，平常的確常有人會使用hi33的音"
DF205J2067_041.wav,伯伯住的樓房有電梯,阿伯戴个樓屋有電梯,a33 bag21 dai53 gai33 leu113 vug21 rhiu33 tien53 toi33,,
DF205J2067_042.wav,我走路去郵局寄信,𠊎行路去郵局寄信,ngai113 hang113 lu53 ki53 rhiu113 kiug54 gi53 sin53,,去 :發音人讀音為hi33，教育部辭典拼音為ki33，平常的確常有人會使用hi33的音
DF205J2067_043.wav,我在十字路口等你,𠊎在十字路口等你,ngai113 to33 shib54 sii53 lu53 kieu31 den31 hn113,,口 :發音人讀音keu31，正確讀音為kieu31
DF205J2067_044.wav,他這次用信用卡付款,佢這擺用信用卡付款,gi113 lia31 bai31 rhung53 sin53 rhung53 ka31 fu53 kuan31,,"這 :發音人讀音liad54，正確讀音為lia53
信 :發音人讀音sim53，正確讀音為sin53"
DF205J2067_045.wav,弟弟通過認證考試了,老弟通過認證考試咧,lo31 te33 tung33 go53 ngin53 zhin53 kau31 shi53 le33,,
DF205J2067_046.wav,在網路上買東西很方便,在網路買東西當利便,to33 miong31 lu53 mai33 dung33 si33 dong33 li53 pien53,,
DF205J2067_047.wav,新的工作你做得習慣嗎,新个頭路你做得慣無,sin33 gai33 teu113 lu53 hn113 zo53 ded21 guan53 mo113,,新 :發音人讀音sim33，正確讀音為sin33
DF205J2067_048.wav,今天放假不必上學,今晡放尞毋使去學校,gim33 bi33 biong53 liau53 m113 sii31 ki53 hog54 gau31,,去 :發音人讀音為hi33，教育部辭典拼音為ki33，平常的確常有人會使用hi33的音
DF205J2067_049.wav,休息一下好久不見,歇睏一下恁久無看著,hied21 kun53 rhid21 ha53 an31 giu31 mo113 kon53 do31,,
DF205J2067_050.wav,謝謝你不客氣對不起,勞瀝毋使細義失禮,lo113 lad54 m113 sii31 se53 ngi53 shid21 li33,,"瀝 :發音人讀音lag54，正確讀音為led54
失 :發音人讀音shib21，正確讀音為shid21"
DF205J2067_051.wav,不好意思沒關係拜託你,敗勢無關係拜託你,pai33 she53 mo113 guan33 he53 bai53 tog21 hn113,,
DF205J2067_052.wav,你認識他嗎我不認識他,你識佢無𠊎毋識佢,hn113 shid21 gi113 mo113 ngai113 m113 shid21 gi113,,"識 :發音人讀音shib21，正確讀音為shid21
識 :發音人讀音shib21，正確讀音為shid21"
DF205J2067_053.wav,我好累我好高興,𠊎當𤸁𠊎當暢,ngai113 dong33 kioi53 ngai113 dong33 tiong53,,
DF205J2067_054.wav,爸爸每天早上都要喝咖啡,阿爸逐朝脣都愛食咖啡,a33 ba33 dag21 zheu33 shun113 do33 oi53 shid54 ga33 bi33,,食 :發音人讀音shib54，正確讀音為shid54
DF205J2067_055.wav,他穿新褲子去外婆家,佢著新褲去外阿婆屋家,gi113 zhog21 sin33 ku53 ki53 nguai53 a33 po113 vug21 ka33,,新 :發音人讀音sim33，正確讀音為sin33
DF205J2067_056.wav,請問這件衣服是什麼尺寸,請問這領衫係麼个尺寸,ciang31 mun53 lia31 liang33 sam33 he53 ma31 gai33 chag21 cun53,,
DF205J2067_057.wav,這麼吵你怎麼受得了,恁吵鬧你仰脣佇得著,an31 cau113 nau53 hn113 ngiong31 shun113 du53 ded21 diau113,,
DF205J2067_058.wav,他們每天晚上都要去補習,厥等逐暗晡都愛去補習,gia33 nen35 dag21 am53 bu33 do33 oi33 ki53 bu31 sib54,,去 :發音人讀音為hi33，教育部辭典拼音為ki33，平常的確常有人會使用hi33的音
DF205J2067_059.wav,夏天大家比較喜歡去海邊玩,熱天大家較好去海脣尞,ngied54 tien33 tai53 ga33 ka33 hau53 ki53 hoi31 shun113 liau53,,"較 :發音人讀音kag21，正確讀音為ka33
去 :發音人讀音為hi53，教育部辭典拼音為ki53，平常的確常有人會使用hi53的音"
DF205J2067_060.wav,生病要快點去看醫生,有病愛遽遽去分先生看,rhiu33 piang53 oi33 giag21 giag21 ki53 bun33 sin33 sen33 kon53,,去 :發音人讀音為hi33，教育部辭典拼音為ki33，平常的確常有人會使用hi33的音
DF205J2067_061.wav,今天的報紙你看了嗎,今晡日个報紙你有看吂,gim33 bi33 ngid21 gai33 bo53 zhi31 hn113 rhiu33 kon53 mang113,,今 :發音人讀音gim31，正確讀音為gim33
DF205J2067_062.wav,我昨晚失眠睡不著,𠊎昨暗晡反躁睡毋得,ngai113 ca113 am53 bu33 fan31 cau53 shoi53 m113 ded21,,
DF205J2067_063.wav,表哥每天都很認真工作,表哥逐日都當認真做事,biau31 go33 dag21 ngid21 do33 dong33 ngin53 zhin33 zo53 she53,,
DF205J2067_064.wav,晚上開車要比較小心一點,暗晡頭駛車愛較注意兜,am53 bu33 teu113 sii31 cha33 oi33 ka33 zhu53 rhi53 deu33,,較 :發音人讀音kag21，正確讀音為ka33
DF205J2067_065.wav,請問可以找誰幫忙,請問使得尋麼人𢯭手,ciang31 mun53 sii31 ded21 cim113 me31 ngin113 ten53 shiu31,,
DF205J2067_066.wav,你會了嗎讓我想一下,你曉得吂分𠊎想一下,hn113 hiau31 ded21 mang113 bun33 ngai113 siong31 rhid21 ha53,,
DF205J2067_067.wav,你住哪裡有人在家嗎,你戴哪位有人在屋家無,hn113 dai53 ne53 vui53 rhiu33 ngin113 to33 vug21 ka33 mo113,,
DF205J2067_068.wav,我回來了你要去哪裡,𠊎轉來咧你愛去哪位,ngai113 zhon31 loi113 le33 hn113 oi33 ki53 ne53 vui53,,
DF205J2067_069.wav,早安吃飽飯了嗎最近好嗎,恁早食飽吂恁久好無,an31 zo31 shid54 bau31 mang113 an31 giu31 ho31 mo113,,
DF205J2067_070.wav,好可愛喔好討厭喔,還得人惜哦還得人惱哦,han113 ded21 ngin113 siag21 o31 han113 ded21 ngin113 nau33 o31,,
DF205J2067_071.wav,你好棒啊哪裡哪裡,你還慶哦哪有無影啦,hn113 han113 kiang53 o31 ne53 rhiu33 mo113 rhang31 la31,,
DF205J2067_072.wav,我們經常一起團購美食,吾等輒輒共下鬥緊買美食,nga33 nen35 ziab54 ziab54 kiung53 ha53 deu53 gin31 mai33 mui33 shid54,,"緊 :發音人讀音gim31，正確讀音為gin31
食 :發音人讀音shib54，正確讀音為shid54"
DF205J2067_073.wav,發霉的東西就不能吃了,生菇个東西斯使毋得食欸,sang33 gu33 gai33 dung33 si33 sii33 sii31 m113 ded21 shid54 e31,,食 :發音人讀音shib54，正確讀音為shid54
DF205J2067_074.wav,明天可以在家打電動,天光日使得在屋家打電動,tien33 gong33 ngid21 sii31 ded21 to33 vug21 ka33 da31 tien53 tung53,,
DF205J2067_075.wav,一起去公園運動,共下來*去公園運動啊嚟,kiung53 ha53 loi113 *ki53 li35 gung33 rhen113 rhun53 tung53 a33 le113,,"園 :發音人讀音ngien113，正確讀音為rhen113
來去 loi113 ki53 發合音 li35"
DF205J2067_076.wav,這條路比較進那條路比較遠,這條路較近該條路較遠,lia31 tiau113 lu53 ka33 kiun33 gai53 tiau113 lu53 ka33 rhen31,,
DF205J2067_077.wav,喝酒不開車開車不喝酒,食酒莫駛車駛車莫食酒,shid54 ziu31 mog54 sii31 cha33 sii31 cha33 mog54 shid54 ziu31,,"食 :發音人讀音shib54，正確讀音為shid54
食 :發音人讀音shib54，正確讀音為shid54"
DF205J2067_078.wav,我忙得不可開交,𠊎無閒去會轉鉸毋得咧,ngai113 mo113 han113 ki53 voi53 zhon31 gau53 m113 ded21 le33,,去 :發音人讀音hi33，正確讀音為ki53
DF205J2067_079.wav,爸爸不在家媽媽還沒回家,阿爸無在屋家阿姆還吂轉,a33 ba33 mo113 to33 vug21 ka33 a33 me33 han113 mang113 zhon31,,
DF205J2067_080.wav,再見慢走有空來玩,正來尞順行有閒正來尞,zhang33 loi113 liau53 shun53 hang113 rhiu33 han113 zhang33 loi113 liau53,,
DF205J2067_081.wav,她丈夫很英俊你太太很漂亮,厥老公當派頭若餔娘當靚,gia33 lo31 gung33 dong33 pai53 tau113 ngia33 bu33 ngiong113 dong33 ziang33,,
DF205J2067_082.wav,天氣多變要穿暖一點,天時多變化愛著較燒暖兜,tien33 shi113 do33 bien53 fa53 oi33 zhog21 ka33 sheu33 non33 deu35,,較 :發音人讀音kad21，正確讀音為ka33
DF205J2067_083.wav,便利商店可以買到很多東西,便利商店使得買著當多東西,pien53 li53 shong33 diam53 sii31 ded21 mai33 do31 dong33 do33 dung33 si33,,
DF205J2067_084.wav,下次再約時間一起閒聊,下次擺過再約時間共下坐尞,ha53 ci53 bai31 go53 zai53 rhog21 shi113 gien33 kiung53 ha53 co33 liau53,,
DF205J2067_085.wav,中午很熱不可以出去運動,當晝頭當熱毋好出去運動,dong33 zhiu53 teu113 dong33 ngied54 m113 ho31 chud21 ki53 rhun53 tung53,,
DF205J2067_086.wav,我正在講電話請等一下,𠊎當講緊電話請等一下,ngai113 dong33 gong31 gin31 tien53 fa53 ciang31 den31 rhid21 ha53,,"緊 :發音人讀音gim31，正確讀音為gin31
等 :發音人讀音dem31，正確讀音為den31"
DF205J2067_087.wav,我準備好了可以開始了,𠊎準備好咧使得開始咧,ngai113 zhun31 pi53 ho31 le33 sii31 ded21 koi33 chi31 le33,,
DF205J2067_088.wav,這件事情被你講得這麼輕鬆,這件事情分你講到恁輕可,lia31 kien53 sii53 cin113 bun33 hn113 gong31 do53 an31 kiang33 ko31,,"這 :發音人讀音為liab21，正確讀音為lia31
你 :發音人讀音為ng113，正確讀音為hn113
到 :發音人讀音為do31，正確讀音為do53"
DF205J2067_089.wav,抱歉打擾了你要趕時間嗎,敗勢勞攪咧你愛赴時間無,pai33 she53 lo113 gau31 le33 hn113 oi33 fu53 shi113 gien33 mo113,,
DF205J2067_090.wav,有什麼問題嗎你想得真周到,有麼个問題無你想去真周到,rhiu33 ma31 gai33 mun53 ti113 mo113 hn113 siong31 ki53 zhin33 zhiu33 do53,,"去 :發音人讀音為hi33，教育部辭典拼音為ki33，平常的確常有人會使用hi33的音 
食 :發音人讀音zhim33，正確讀音為zhin33"
DF205J2067_091.wav,最近忙什麼他要照顧他媽媽,這站無閒麼个佢愛照顧厥姆,lia31 cam53 mo113 han113 ma31 gai33 gi113 oi33 zheu53 gu53 gia33 me33,,這 :發音人讀音為liab21，正確讀音為lia31
DF205J2067_092.wav,客家人用福菜當伴手禮相當受歡迎,客人用覆菜做等路已受歡迎,kag21 ngin113 rhung53 pug21 coi53 zo53 den31 lu53 i53 shiu53 fan33 ngiang113,,"覆 :發音人讀音pug54，正確讀音為pug21
已 :發音人讀音rhi53，正確讀音為i53
迎 :發音人讀音rhang113，正確讀音為ngiang113"
DF205J2067_093.wav,爺爺有糖尿病不能吃太甜,阿爹有糖尿病使毋得食忒甜,a33 da33 rhiu33 tong113 ngiau53 piang53 sii31 m113 ded21 shid54 ted21 tiam113,,食 :發音人讀音shib54，正確讀音為shid54
DF205J2067_094.wav,把燈關掉麻煩你開燈好嗎,電火關撇佢麻煩你開電火好無,tien53 fo31 guan33 ped21 gi113 ma113 fan113 hn113 koi33 tien53 fo31 ho31 mo113,,
DF205J2067_095.wav,快點快來不及了開車要小心,遽兜會赴毋著咧駛車愛細義,giag21 deu35 voi33 fu53 m113 do31 le33 sii31 cha33 oi33 se53 ngi53,,
DF205J2067_096.wav,請問貴姓我姓黃名叫大民,請問上姓𠊎姓黃安做大民,ciang31 mun53 shong53 siang53 ngai113 siang53 vong113 on33 zo53 tai53 min113,,
DF205J2067_097.wav,生日快樂身體健康萬事如意,生日快樂身體康健萬事如意,sang33 ngid21 kuai53 log54 shin33 ti31 kong33 kien53 van53 sii53 rhi113 rhi53,,
DF205J2067_098.wav,客家文化園區經常舉辦展覽活動,客家文化園區輒輒舉辦展覽活動,kag21 ga33 vun113 fa53 rhen113 ki33 ziab54 ziab54 gi31 pan53 zhen31 lam31 fad54 tung53,,
DF205J2067_099.wav,你今天穿得好漂亮要去喝喜酒是嗎,你今晡著都恁派頭愛去食酒係無,hn113 gim33 bi33 zhog21 do33 an31 pai53 teu113 oi33 ki53 shid54 ziu31 he53 mo113,,"都 :發音人讀音為do31，正確讀音為do33
去 :發音人讀音為hi33，教育部辭典拼音為ki33，平常的確常有人會使用hi33的音 
食 :發音人讀音shib54，正確讀音為shid54"
DF205J2067_100.wav,你遲到了請稍等我馬上過來,你慢到咧請等一下𠊎黏時來,hn113 man53 do53 le33 ciang31 den31 rhid21 ha53 ngai113 ngiam113 shi113 loi113,,
DF205J2067_101.wav,我要睡午覺很晚了可以上床睡覺了,𠊎愛睡當晝恁夜咧好去睡目咧,ngai113 oi33 shoi53 dong33 zhiu53 an31 rha53 le33 ho31 ki53 shoi53 mug21 le33,,"恁 :發音人讀音am31，正確讀音為an31
去 :發音人讀音為hi53，教育部辭典拼音為ki53，平常的確常有人會使用hi53的音"
DF205J2067_102.wav,祖父在房間裡休息弟弟在客廳看電視,阿爹在間肚歇睏老弟在廳下看電視,a33 da33 to33 gien33 du31 hied21 kun53 lo31 te33 to33 ten33 ha33 kon53 tien53 shi53,,
DF205J2067_103.wav,媽媽在廚房煮飯我每天早上掃地,阿姆在灶下煮飯𠊎逐朝脣掃地泥,a33 me33 to33 zo53 ha33 zhu31 pon53 ngai113 dag21 zheu33 shun113 so53 ti53 ne113,,
DF205J2067_104.wav,有客人在不可以打赤膊進入室內請脫鞋,有人客來毋好打赤膊入屋請脫鞋,rhiu33 ngin113 kag21 loi113 m113 ho31 da31 chag21 bog21 ngib54 vug21 ciang31 tod21 he113,,脫:發音人讀音tog21，正確讀音為tod21
DF205J2067_105.wav,搭火車要先買票請問高鐵車站怎麼走,坐火車愛先買票請問高鐵車頭仰脣行,co33 fo31 cha33 oi33 sien33 mai33 piau53 ciang31 mun53 go33 tied21 cha33 teu113 ngiong31 shun113 hang113,,
DF205J2067_106.wav,我尿急想要小便妹妹在浴室洗澡,𠊎尿出想愛屙尿老妹在洗身間洗身,ngai113 ngiau53 chud21 siong31 oi33 o33 ngiau53 lo31 moi53 to33 se31 shin33 gien33 se31 shin33,,身:發音人讀音shim33，正確讀音為shin33
DF205J2067_107.wav,叫計程車不必煩惱停車問題搭飛機比較快,喊計程車毋使愁停車問題坐飛行機較遽,hem33 gie53 chang113 cha33 m113 sii31 seu113 tin113 cha33 mun53 ti113 co33 fui33 hang113 gi33 ka33 giag21,,"計 :發音人讀音ge53，正確讀音為gie53
較 :發音人讀音kag21，正確讀音為ka33"
DF205J2067_109.wav,老人搭公車免費搭捷運不可以吃東西,老人家坐巴士毋使錢坐捷運做毋得食東西,lo31 ngin113 ga33 co33 ba33 sii31 m113 sii31 cien113 co33 ciab54 rhun53 sii31 m113 ded21 shid54 dung33 si33,,食 :發音人讀音shib54，正確讀音為shid54
DF205J2067_110.wav,冬天穿毛衣很暖和夏天很熱穿短袖就可以了,寒天著膨線衫當燒暖熱天當熱著短袖斯使得咧,hon113 tien33 zhog21 pong53 sien53 sam33 dong33 sheu33 non33 ngied54 tien33 dong33 ngied54 zhog21 don31 ciu53 sii33 sii31 ded21 le33,,
DF205J2067_111.wav,前面向右轉就到新竹縣政府了,頭前斡正手片斯到新竹縣政府咧,teu113 cien113 vad21 zhin53 shiu31 pien31 sii33 do53 sin33 zhug21 rhen53 zhin53 fu31 le33,,
DF205J2067_112.wav,他住哪裡他住屏東縣,佢戴哪位佢戴屏東縣,gi113 dai53 ne53 vui53 gi113 dai53 pin113 dung33 rhen53,,
DF205J2067_113.wav,會議地點在哪裡會議地點在屏東縣新埤鄉,會議地點在哪位會議地點在屏東縣新埤鄉,fui53 ngi53 ti53 diam31 to33 ne53 vui53 fui53 ngi53 ti53 diam31 to33 pin113 dung33 rhen53 sin33 bi33 hiong33,,
DF205J2067_114.wav,這張照片是什麼地方這是連江縣東引鄉,這張相片係麼个所在這係連江縣東引鄉,lia31 zhong33 siong53 pien31 he53 ma31 gai33 so31 cai53 lia31 he53 lien113 gong33 rhen53 dung33 rhin31 hiong33,,"這 :發音人讀音為liab21，正確讀音為lia31
引 :發音人讀音為rhim31，正確讀音為rhin31"
DF205J2067_115.wav,請問彰化縣鹿港鎮公所在幾樓在八樓,請問彰化縣鹿港鎮公所在幾多樓在八樓,ciang31 mun53 zhong33 fa53 rhen53 lug54 gong31 zhin31 gung33 so31 to33 gid21 do33 leu113 to33 bad21 leu113,,"鹿:發音人讀音為lud21，正確讀音為lug54
鎮 :發音人讀音為zhim31，正確讀音為zhin31"
DF205J2067_116.wav,我要回臺北火車停在第六月臺要快點去才不會趕不上,𠊎愛轉臺北火車停在第六月臺愛遽遽去正毋會赴毋著,ngai113 oi33 zhon31 toi113 bed21 fo31 cha33 tin113 to33 ti53 liug21 ngied54 toi113 oi33 giag21 giag21 ki53 zhang33 m113 voi33 fu53 m113 do31,,去 :發音人讀音為hi53，教育部辭典拼音為ki53，平常的確常有人會使用hi53的音
DF205J2067_117.wav,哥哥後天要坐五點的火車去基隆出差,阿哥後日愛坐五點个火車去潮州出差,a33 go33 heu33 ngid21 oi33 co33 ng31 diam31 gai33 fo31 cha33 ki53 cheu113 zhiu33 chud21 cai33,,去 :發音人讀音為hi53，教育部辭典拼音為ki53，平常的確常有人會使用hi53的音
DF205J2067_118.wav,明天我要坐首班車去花蓮車到站了趕快下車,天光𠊎愛坐頭枋車去花蓮車到站了遽遽落車,tien33 gong35 ngai113 oi33 co33 teu113 biong33 cha33 ki53 fa33 lien113 cha33 do53 zam53 le33 giag21 giag21 log54 cha33,,"去 :發音人讀音為hi33，教育部辭典拼音為ki33，平常的確常有人會使用hi33的音 
遽遽 :發音人讀音giab21 giab21，正確讀音為giag21 giag21"
DF205J2067_119.wav,請問鳳山火車站怎麼去我帶你去火車站好多人喔,請問鳳山火車頭仰脣去𠊎帶你去火車頭還多人哦,ciang31 mun53 fung53 san33 fo31 cha33 teu113 ngiong31 shun113 ki53 ngai113 dai53 hn113 ki53 fo31 cha33 teu113 han113 do33 ngin113 o31,,"去 :發音人讀音為hi53，教育部辭典拼音為ki53，平常的確常有人會使用hi53的音 
去 :發音人讀音為hi53，教育部辭典拼音為ki53，平常的確常有人會使用hi53的音"
DF205J2067_120.wav,接駁車會從本院開到潮州火車站在本院大門口乘車,接送車會對本院駛到潮州火車頭在本院大門口坐車,ziab21 sung53 cha33 voi33 dui53 bun31 rhen53 sii31 do53 cheu113 zhiu33 fo31 cha33 teu113 to33 bun31 rhen53 tai53 mun113 kieu31 co33 cha33,,"到 :發音人讀音為do33，正確讀音為do53
口 :發音人讀音為keu31，正確讀音為kieu31"
DF205J2067_121.wav,請問你從哪裡來我從基隆來,請問你對哪位來𠊎對基隆來,ciang31 mun53 hn113 dui53 ne53 vui53 loi113 ngai113 dui53 gi33 lung113 loi113,,
DF205J2067_122.wav,我爸準備去要臺南出差一個半月,吾爸準備愛去臺南出差個半月,nga33 ba33 zhun31 pi53 oi33 ki53 toi113 nam113 chud21 cai33 gai53 ban53 ngied54,,去 :發音人讀音為hi33，教育部辭典拼音為ki33，平常的確常有人會使用hi33的音
DF205J2067_123.wav,他一個人去南投打拚他媽媽很擔心,佢一個人去南投打拚厥姆當愁,gi113 rhid21 gai53 ngin113 ki53 nam113 teu113 da31 biang53 gia33 me33 dong33 seu113,,去 :發音人讀音為hi33，教育部辭典拼音為ki33，平常的確常有人會使用hi33的音
DF205J2067_124.wav,請問你有來過彰化嗎,請問你識來過彰化無,ciang31 mun53 hn113 shid21 loi113 go53 zhong33 fa53 mo113,,識 :發音人讀音shib21，正確讀音為shid21
DF205J2067_125.wav,請問我要去新竹該怎麼轉車,請問𠊎愛去新竹愛仰脣盤車,ciang31 mun53 ngai113 oi33 ki53 sin33 zhug21 oi33 ngiong31 shun113 pan113 cha33,,"去 :發音人讀音為hi33，教育部辭典拼音為ki33，平常的確常有人會使用hi33的音 
新 :發音人讀音sim33，正確讀音為sin33"
DF205J2067_126.wav,請問到臺東要開多久要開八小時,請問到臺東愛駛幾久愛駛八點鐘久,ciang31 mun53 do53 toi113 dung33 oi33 sii31 gid21 giu31 oi33 sii31 bad21 diam31 zhung33 giu31,,"幾 :發音人讀音gi31，正確讀音為gid21
八 :發音人讀音bag21，正確讀音為bad21"
DF205J2067_127.wav,到澎湖大約還有幾公里還有三公里,到澎湖大約還有幾多公里還有三公里,do53 pang113 fu113 tai53 rhog21 han113 rhiu33 gid21 do33 gung33 li33 han113 rhiu33 sam33 gung33 li33,,
DF205J2067_128.wav,阿松哥十月十九日要娶妻,阿松哥十月十九愛討餔娘,a33 ciung113 go33 shib54 ngied54 shib54 giu31 oi33 to31 bu33 ngiong113,,
DF205J2067_129.wav,二月二十五日學校放假那天去看電影好嗎,二月二十五學校放尞該日來去看電影好無,ngi53 ngied54 ngi53 shib54 ng31 hog54 gau31 biong53 liau53 gai53 ngid21 loi113 ki53 kon53 tien53 rhang31 ho31 mo113,,去 :發音人讀音為hi33，教育部辭典拼音為ki33，平常的確常有人會使用hi33的音
DF205J2067_130.wav,根據政府的公告十月六日放假不過前一個週六要上班,根據政府个公告十月初六放尞毋過前一個禮拜六愛上班,gin33 ki31 zhin53 fu31 gai33 gung33 go53 shib54 ngied54 cu33 liug21 biong53 liau53 m113 go53 cien113 rhid21 gai53 li33 bai53 liug21 oi33 shong53 ban33,,
DF205J2067_131.wav,王先生你掛的是八月十八日上午的門診,王先生你掛个係八月十八朝脣个門診,vong113 sin33 sen33 hn113 gua53 gai33 he53 bad21 ngied54 shib54 bad21 zheu33 shun113 gai33 mun113 zhin31,,"八 :發音人讀音bag21，正確讀音為bad21
八 :發音人讀音bag21，正確讀音為bad21"
DF205J2067_132.wav,報名從六月七日開始到七月六日為止,報名對六月初七起勢到七月初六為止,bo53 miang113 dui53 liug21 ngied54 cu33 cid21 ki31 shi53 do53 cid21 ngied54 cu33 liug21 vui113 zhi31,,
DF205J2067_133.wav,客語認證的認證日是十一月十日,客語認證个認證日係十一月初十,kag21 ngi33 ngin53 zhin53 gai33 ngin53 zhin53 ngid21 he53 shib54 rhid21 ngied54 cu33 shib54,,
