檔名,中文,客語漢字,客語拼音,標籤,備註
DF206J2062_165.wav,你掛的是七十八號要先向你收掛號費兩百元,你掛个係七十八號愛先同你收掛號費兩百箍,hn113 gua53 gai33 he53 cid21 shib54 bad21 ho53 oi53 sien33 tung113 hn113 shiu33 gua53 ho53 fui53 liong31 bag21 kieu33,,
DF206J2062_166.wav,請你到藥局領藥你的號碼是二十七號謝謝請慢走,請你去藥局領藥若个號碼係二十七號勞瀝請慢行,ciang31 hn113 ki53 rhog54 kiug54 liang33 rhog54 ngia33 gai33 ho53 ma33 he53 ngi53 shib54 cid21 ho53 lo113 lad54 ciang31 man53 hang113,,
DF206J2062_167.wav,你是七十九號等一下叫到你的號碼再請你去櫃臺辦理,你係七十九號等加喊着若號碼正請你去櫃臺辦理,hn113 he53 cid21 shib54 giu31 ho53 den31 ga33 hem33 do31 ngia33 ho53 ma33 zhang33 ciang31 hn113 ki53 kui53 toi113 pan53 li33,,
DF206J2062_168.wav,這繩子多長八十八公尺這菜怎麼賣一把三十元,這索幾長八十八公尺這菜仰脣賣一抓三十箍,lia31 sog21 gid21 chong113 bad21 shib54 bad21 gung33 chag21 lia31 coi53 ngiong31 shun113 mai53 rhid21 za33 sam33 shib54 kieu33,,
DF206J2062_169.wav,檢查報告大約要等十八分鐘請你先坐一下,檢查報告大約愛等十八分鐘請你先坐一下,giam31 ca113 bo53 go53 tai53 rhog21 oi33 den31 shib54 bad21 fun33 zhung33 ciang31 hn113 sien33 co33 rhid21 ha53,,
DF206J2062_170.wav,司機先生我趕時間六十九分鐘到得了嗎,司機先生𠊎愛趕時間六十九分鐘會到無,sii33 gi33 sin33 sen33 ngai113 oi33 guan31 shi113 gien33 liug21 shib54 giu31 fun33 zhung33 voi33 do53 mo113,,
DF206J2062_171.wav,該起床了快去洗臉刷牙還要多久再五分鐘,好䟘床咧遽遽去洗面鑪牙齒還愛幾久過五分鐘,ho31 hong53 cong113 le33 giag21 giag21 ki53 se31 mien53 lu53 nga113 chi31 han113 oi33 gid21 giu31 go53 ng31 fun33 zhung33,,
DF206J2062_172.wav,他這次買火車票花了兩百元,佢這擺買火車票買撇兩百箍,gi113 lia31 bai31 mai33 fo31 cha33 piau53 mai33 ped21 liong31 bag21 kieu33,,
DF206J2062_173.wav,這個多少錢這個九千五百元,這隻幾多錢這隻九千五百箍,lia31 zhag21 gid21 do33 cien113 lia31 zhag21 giu31 cien33 ng31 bag21 kieu33,,
DF206J2062_174.wav,他去逛百貨公司刷卡買東西花了六萬元,佢去遶百貨公司刷卡買東西用撇六萬箍,gi113 ki53 lau33 bag21 fo53 gung33 sii33 sod21 ka31 mai33 dung33 si33 rhung53 ped21 liug21 van53 kieu33,,
DF206J2062_175.wav,桌上有八個熱水瓶紙箱裡有九顆球,桌項有八支暖罐紙箱裡肚有九粒球,zog21 hong33 rhiu33 bad21 gi33 non33 guan53 zhi31 siong33 di33 du31 rhiu33 giu31 liab54 kiu113,,
DF206J2062_176.wav,從這裡走路去火車站要走七分鐘,對這*項行路去火車頭愛行七分鐘,dui53 lia31 *hong53 liong35 hang113 lu53 ki53 fo31 cha33 teu113 oi53 hang113 cid21 fun33 zhung33,,這項 lia31 hong53 發合音 liong35
DF206J2062_177.wav,這本書總共有三百頁我算一下總共要八百元,這本書總共有三百頁𠊎算一下總共愛八百箍,lia31 bun31 shu33 zung31 kiung53 rhiu33 sam33 bag21 rhab54 ngai113 son53 rhid21 ha53 zung31 kiung53 oi33 bad21 bag21 kieu33,,
DF206J2062_178.wav,你幾歲了我今年四歲,你幾多歲咧𠊎今年四歲,hn113 gid21 do33 se53 le33 ngai113 gim33 ngien113 si53 se53,,
DF206J2062_179.wav,這件衣服花了我五百元,這領衫買撇𠊎五百箍,lia31 liang33 sam33 mai33 ped21 ngai113 ng31 bag21 kieu33,,
DF206J2062_180.wav,老闆雞蛋一斤多少錢雞蛋一斤十七元,頭家雞卵一斤幾多錢雞卵一斤十七箍,teu113 ga33 gie33 lon31 rhid21 gin33 gid21 do33 cien113 gie33 lon31 rhid21 gin33 shib54 cid21 kieu33,,
DF206J2062_181.wav,剩下這些都賣你九百元就好,伸這兜歸下賣你九百箍斯好,chun33 lia31 deu33 gui33 ha53 mai53 hn113 giu31 bag21 kieu33 sii33 ho31,,
DF206J2062_182.wav,我聽說阿美抽到六千萬的大獎是真的還是假的,𠊎聽講阿美著著六千萬个大獎有影抑無影,ngai113 ten33 gong31 a33 mui33 chog54 do31 liug21 cien33 van53 gai33 tai53 ziong31 rhiu33 rhang31 rha33 mo113 rhang31,,
DF206J2062_183.wav,桌子很久沒擦灰塵很厚叫八個人過去那邊幫忙,桌當久無捽塵灰當賁喊八個人過去該片𢯭手,zog21 dong33 giu31 mo113 cud54 chin113 foi33 dong33 pun33 hem33 bad21 gai53 ngin113 go53 ki53 gai53 pien31 ten53 shiu31,,
DF206J2062_184.wav,請問你家有幾個人我家總共有七個人,請問若屋家有幾多人吾屋家總共有七個人,ciang31 mun53 ngia33 vug21 ka33 rhiu33 gid21 do33 ngin113 nga33 vug21 ka33 zung31 kiung53 rhiu33 cid21 gai53 ngin113,,
DF206J2062_185.wav,我今天遲到三分鐘被老師罵,𠊎今晡慢到三分鐘分先生罵,ngai113 gim33 bi33 man53 do53 sam33 fun33 zhung33 bun33 sin33 sen33 ma53,,
DF206J2062_186.wav,他請假四天被老闆扣薪,佢請假四日分頭家扣月給,gi113 ciang31 ga31 si53 ngid21 bun33 teu113 ga33 kieu53 ngied54 gib21,,
DF206J2062_187.wav,請問到終點還有幾站還有五站就會到了,請問到終點還有幾多站還有五站斯會到咧,ciang31 mun53 do53 zhung33 diam31 han113 rhiu33 gid21 do33 zam53 han113 rhiu33 ng31 zam53 sii33 voi33 do53 le33,,
DF206J2062_188.wav,你兒子今年幾歲我兒子今年兩歲好可愛喔,若倈今年幾多歲吾倈今年兩歲還得人惜哦,ngia33 lai53 gim33 ngien113 gid21 do33 se53 nga33 lai53 gim33 ngien113 liong31 se53 han113 ded21 ngin113 siag21 o31,,
DF206J2062_189.wav,九斤龍眼不知道是太多還是太少,九斤牛眼毋知係忒多抑係忒少,giu31 gin33 ngiu113 ngien31 m113 di33 he53 ted21 do33 rha33 he33 ted21 sheu31,,
DF206J2062_190.wav,老闆請了六個女孩來招攬生意,頭家請六個細妹來拉生理,teu113 ga33 ciang31 liug21 gai53 se53 moi53 loi113 lai33 sen33 li33,,
DF206J2062_191.wav,如果要掛號麻煩健保卡給我並繳八百元,係愛掛號麻煩健保卡分𠊎還過繳八百箍,he33 oi53 gua53 ho53 ma113 fan113 kien53 bo31 ka31 bun33 ngai113 han113 go53 giau31 bad21 bag21 kieu33,,
DF206J2062_192.wav,三餐飯後吃藥一天吃三次一次七顆,三餐食飽飯食藥一日食三擺一擺七粒,sam33 con33 shid54 bau31 pon53 shid54 rhog54 rhid21 ngid21 shid54 sam33 bai31 rhid21 bai31 cid21 liab54,,
DF206J2062_193.wav,這兩種藥不可以一起服用要間隔三小時才可以吃喔,這兩種藥毋好共下食愛間三點鐘正好食哦,lia31 liong31 zhung31 rhog54 m113 ho31 kiung53 ha53 shid54 oi33 gam53 sam33 diam31 zhung33 zhang33 ho31 shid54 o33,,
DF206J2062_194.wav,要注意喔這兩種眼藥水請間隔四小時再點,愛注意喔這兩種目藥水請間四點鐘正點,oi33 zhu53 rhi53 o33 lia31 liong31 zhung31 mug21 rhog54 shui31 ciang31 gam53 si53 diam31 zhung33 zhang33 diam31,,
DF206J2062_195.wav,你要休幾天我要休五天因為舅舅要娶老婆,你愛尞幾久𠊎愛尞五日因為阿舅愛討餔娘,hn113 oi33 liau53 gid21 giu31 ngai113 oi33 liau53 ng31 ngid21 rhin33 vui53 a33 kiu33 oi53 to31 bu33 ngiong113,,
DF206J2062_196.wav,我們有兩個人我們想要坐靠窗的位置,吾等有兩個人吾等想愛坐偎窗門个位,nga33 nen35 rhiu33 liong31 gai53 ngin113 nga33 nen35 siong31 oi53 co33 va31 cung33 mun113 gai33 vui53,,
DF206J2062_197.wav,作文題目是我如果有九萬元想做什麼,作文題目係𠊎若係有九萬箍想愛做麼个,zog21 vun113 ti113 mug21 he53 ngai113 na33 he33 rhiu33 giu31 van53 kieu33 siong31 oi53 zo53 ma31 gai33,,
DF206J2062_198.wav,夜市裡的牛仔褲一條只賣六百又好看又便宜,夜市肚个牛仔褲一領正賣六百又靚又便宜,rha53 shi53 du31 gai33 ngiu113 zii31 ku53 rhid21 liang33 zhang33 mai53 liug21 bag21 rhiu53 ziang33 rhiu53 pien113 ngi113,,
DF206J2062_199.wav,我這陣子咳不停你什麼時候注意到這個問題八天前,𠊎恁久嗽無停你哪時注意着這個問題八日前,ngai113 an31 giu31 cug54 mo113 tin113 hn113 ne53 shi113 zhu53 rhi53 do31 lia31 gai53 mun53 ti113 bad21 ngid21 cien113,,
DF206J2062_200.wav,檢查好了七天後再回診聽報告,檢查好咧七日後正轉來分先生看聽報告,giam31 ca113 ho31 le33 cid21 ngid21 heu53 zhang33 zhon31 loi113 bun33 sin33 sen33 kon53 ten33 bo53 go53,,
DF206K2002_001.wav,蛻變記得兒子讀小學的時候,蛻變記得倈讀小學个時節,tui53 bien53 gi53 ded21 lai53 tug54 siau31 hog54 gai33 shi113 zied21,,
DF206K2002_002.wav,放學回到家後就歡歡喜喜的跟我分享,放學轉屋家歡歡喜喜同𠊎分享,biong53 hog54 zhon31 vug21 ka33 fan33 fan33 hi31 hi31 tung113 ngai113 fun33 hiong31,,
DF206K2002_003.wav,上自然課老師介紹蝴蝶他覺得很有趣,上自然課先生紹介蝶佢試著當生趣,shong53 cii53 rhen113 ko53 sin33 sen33 sheu53 gai53 rhag54 gi113 chi53 do31 dong33 sen33 ci53,,
DF206K2002_004.wav,就問我媽可以養毛毛蟲嗎,問𠊎阿姆使得畜㸐毛蟲無,mun53 ngai113 a33 me33 sii31 ded21 hiug21 nad21 mo33 chung113 mo113,,
DF206K2002_005.wav,我只聽說過有人養魚養蠶養鍬形蟲,𠊎單淨聽過有人畜魚畜蠶畜剪刀蛄,ngai113 dan33 ciang53 ten33 go53 rhiu33 ngin113 hiug21 ng113 hiug21 cam113 hiug21 zien31 do33 gu33,,
DF206K2002_006.wav,哪會有人養毛毛蟲,哪有人畜㸐毛蟲,ne53 rhiu33 ngin113 hiug21 nad21 mo33 chung113,,
DF206K2002_007.wav,那時候我在學校當志工,該時節𠊎在學校做志工,gai53 shi113 zied21 ngai113 to33 hog54 gau31 zo53 zhi53 gung33,,
DF206K2002_008.wav,跟圖書館裡的小女孩聊天,同圖書室个細阿姊打嘴鼓,tung113 tu113 shu33 shid21 gai33 se53 a33 ze53 da31 zhoi53 gu31,,
DF206K2002_009.wav,她說只要種一棵柚子樹或是橘子樹,佢講單淨愛種一頭柚樹抑係柑樹,gi113 gong31 dan33 ciang53 oi33 zhung53 rhid21 teu113 rhiu53 shu53 rha33 he53 gam33 shu53,,
DF206K2002_010.wav,就會有蝴蝶飛來下蛋妳再準備一個罐子,斯會有蝶飛來生卵你過準備一隻罐,sii33 voi53 rhiu33 rhag54 bui33 loi113 sang33 lon31 hn113 go53 zhun31 pi53 rhid21 zhag21 guan53,,
DF206K2002_011.wav,裡面放一枝小樹枝這樣就可以囉,裡肚放一支細樹椏恁泥斯使得咧,di33 du31 biong53 rhid21 gi33 se53 shu53 va33 an31 ne113 sii33 sii31 ded21 le33,,
DF206K2002_012.wav,我一聽到心裡覺得懷疑,𠊎一聽著心肝肚當疑狐,ngai113 rhid21 ten33 do31 sim33 gon33 du31 dong33 ngi113 fu113,,
DF206K2002_013.wav,自己有不曾住過鄉下種一棵柚子樹就能引來蝴蝶怎麼可能,自家又毋識戴莊下種一頭柚樹斯會餳蝶來哪有可能,ci33 ga33 rhiu53 m113 shid21 dai53 zong33 ha33 zhung53 rhid21 teu113 rhiu53 shu53 sii33 voi33 sia113 rhag54 loi113 ne53 rhiu33 ko31 nen113,,
DF206K2002_014.wav,毋過狗咬蒼蠅賭運氣姑且試看看也好,毋過狗呷烏蠅賭造化罔試看看也好,m113 go53 gieu31 gab54 vu33 rhin113 du31 co53 fa53 mong31 chi53 kon53 kon53 rha33 ho31,,
DF206K2002_015.wav,說來也奇怪有一天真的有一隻蝴蝶,講來也奇怪有一日正經有一隻蝶,gong31 loi113 rha33 ki113 guai53 rhiu33 rhid21 ngid21 zhin53 gin33 rhiu33 rhid21 zhag21 rhag54,,
DF206K2002_016.wav,在我們種的柚子樹旁飛來飛去飛上飛下,在吾等種个柚樹脣飛來飛去飛上飛落,to33 nga33 nen35 zhung53 gai33 rhiu53 shu53 shun113 bui33 loi113 bui33 ki53 bui33 shong53 bui33 log54,,
DF206K2002_017.wav,心想牠在做甚麼呢,心肝愐佢在做麼个呢,sim33 gon33 men31 gi113 to33 zo53 ma31 gai33 ne33,,
DF206K2002_018.wav,我眼睜睜看著牠邊拍翅膀,𠊎目金金緊看佢翼緊撥,ngai113 mug21 gim33 gim33 gin31 kon53 gi113 rhid54 gin31 bad54,,
DF206K2002_019.wav,一邊從屁股的尾端排出小小顆黃黃的卵下在葉背,又緊對屎胐尾屙出細細粒黃黃个卵包在葉背,rhiu53 gin31 dui53 shi53 vud21 mui33 o33 chud21 se53 se53 liab54 vong113 vong113 gai33 lon31 bau33 to33 rhab54 boi53,,
DF206K2002_020.wav,我小心翼翼摘下這片葉子帶回屋裡放進罐子裡,𠊎細心細義摘這皮葉落來帶轉屋家放入罐肚,ngai113 se53 sim33 se53 ngi53 zag21 lia31 pi113 rhab54 log54 loi113 dai53 zhon31 vug21 ka33 biong53 ngib54 guan53 du31,,
DF206K2002_021.wav,過了幾天細細的蟲從蛋裡鑽出來,幾日過後幼幼个蟲對卵肚鑽出來,gi31 ngid21 go53 heu53 rhiu53 rhiu53 gai33 chung113 dui53 lon31 du31 zon53 chud21 loi113,,
DF206K2002_022.wav,一出生自己就把卵殼吃掉,一出世自家斯食撇卵殼,rhid21 chud21 she53 ci33 ga33 sii33 shid54 ped21 lon31 kog21,,
DF206K2002_023.wav,毛毛蟲很挑食只吃自己喜歡的葉子,㸐毛蟲當擇食單淨食佢合意个葉,nad21 mo33 chung113 dong33 tog54 shid54 dan33 ciang53 shid54 gi113 gag21 rhi53 gai33 rhab54,,
DF206K2002_024.wav,像一個肚子很餓的小孩兩三下葉子就被牠吃得精光,像一個肚屎當枵个細孲無兩下半葉斯分佢食去淨淨淨,ciong53 rhid21 gai53 du31 shi31 dong33 iau33 gai33 se53 o113 mo113 liong31 ha53 ban53 rhab54 sii33 bun33 gi113 shid54 ki53 ciang53 ciang53 ciang53,,
DF206K2002_025.wav,只剩下葉脈兒子努力的摘都不夠牠吃,孤孤伸著葉脈倈煞猛摘葉都毋赴佢食,gu33 gu33 chun33 do31 rhab54 mag21 lai53 sad21 mang33 zag21 rhab54 do33 m113 fu53 gi113 shid54,,
DF206K2002_026.wav,牠們不停的吃身體越來越胖身上那白黑相間的衣服太窄了,厥等緊食圓身緊胖大該白烏色个衫褲忒狹,gia33 nen35 gin31 shid54 rhen113 shin33 gin31 pang53 tai53 gai53 pag54 vu33 sed21 gai33 sam33 ku53 ted21 hab54,,
DF206K2002_027.wav,不得已只好將舊衣脫掉換青衣,高不將舊衫脫撇換青衫,go33 bud21 ziong33 kiu53 sam33 tod21 ped21 van53 ciang33 sam33,,
DF206K2002_028.wav,有時候頑皮好動的兒子沒事找事做用手去逗弄牠,成半下賤手个倈係無事尋事做用手去撩佢,shang113 ban53 ha53 cien53 shiu31 gai33 lai53 he33 mo113 she53 cim113 she53 zo53 rhung53 shiu31 ki53 liau113 gi113,,
DF206K2002_029.wav,牠那圓又大的頭就馬上探起來伸出紅色的角,厥該圓圓大大粒个頭那會跈緊探起來伸出紅紅个角,gia33 gai53 rhen113 rhen113 tai53 tai53 liab54 gai33 teu113 na113 voi33 ten113 gin31 dam33 ki31 loi113 chun33 chud21 fung113 fung113 gai33 gog21,,
DF206K2002_030.wav,放出像榴槤一樣臭氣熏天的味道想嚇走欺負牠的人,放出像榴槤樣臭拂拂个氣味想來嚇走欺負佢个人,biong53 chud21 ciong53 liu113 lien113 rhong53 chiu53 fid54 fid54 gai33 ki53 mui53 siong31 loi113 hag21 zeu31 ki33 fu53 gi113 gai33 ngin113,,
DF206K2002_031.wav,不過如果真正遇到鳥油籮蜂牠們連理都不理,毋過若係正經堵著鳥油籮蜂厥等斯插都毋插,m113 go53 na33 he53 zhin53 gin33 du113 do31 diau35 rhiu113 lo113 pung33 gia33 nen35 sii33 cab21 do33 m113 cab21,,
DF206K2002_032.wav,有一次正好被我看見,有一擺恁堵好分𠊎看著,rhiu33 rhid21 bai31 an31 du31 ho31 bun33 ngai113 kon53 do31,,
DF206K2002_033.wav,自己養的毛毛蟲不知被從哪來的蜜蜂吃掉,自家畜个㸐毛蟲毋知分對哪來个蜂食撇,ci33 ga33 hiug21 gai33 nad21 mo33 chung113 m113 di33 bun33 dui53 ne53 loi113 gai33 pung33 shid54 ped21,,
DF206K2002_034.wav,可憐的毛毛蟲想躲都躲不掉,衰過个㸐毛蟲閃都毋離,coi33 go53 gai33 nad21 mo33 chung113 sham31 do33 m113 li53,,
DF206K2002_035.wav,一沒注意到竟然發生這麼悲慘的下場真是可憐啊,一無注意著嗄發生恁悲慘个下場實在衰過,rhid21 mo113 zhu53 rhi53 do31 sa53 fad21 sen33 an31 bi33 cam31 gai33 ha33 chong113 shid54 cai53 coi33 go53,,
DF206K2002_036.wav,毛毛蟲每天都努力的吃葉子吃得身體圓滾滾的還不知飽,㸐毛蟲逐日都煞猛食葉食去圓身肥律律毋知飽,nad21 mo33 chung113 dag21 ngid21 do33 sad21 mang33 shid54 rhab54 shid54 ki53 rhen113 shin33 pui113 lud21 lud21 m113 di33 bau31,,
DF206K2002_037.wav,有一天晚上看牠不停的轉動,有一暗晡看佢𫟧𫟧迴,rhiu33 rhid21 am53 bu33 kon53 gi113 din33 din33 fui113,,
DF206K2002_038.wav,不吃葉子只在罐子裡爬來爬去不知道在忙些什麼,葉毋食單淨在罐肚趖來趖去毋知在該無閒麼个,rhab54 m113 shid54 dan33 ciang53 to33 guan53 du31 so113 loi113 so113 ki53 m113 di33 to33 gai53 mo113 han113 ma31 gai33,,
DF206K2002_039.wav,還拉了一坨綠綠的拉稀兒子問我,還屙一垺青青个瀉巴倈問𠊎,han113 o33 rhid21 pu113 ciang33 ciang33 gai33 sia53 ba113 lai53 mun53 ngai113,,
DF206K2002_040.wav,牠生病了嗎還是拉肚子了,佢破病係無抑係屙痢肚,gi113 po53 piang53 he53 mo113 rha33 he53 o33 li53 du31,,
DF206K2002_041.wav,忽然間牠爬上樹枝,玄玄風佢趖上該樹椏項,hien113 hien113 fung33 gi113 so113 shong33 gai53 shu53 va33 hong33,,
DF206K2002_042.wav,從嘴裡吐絲把自己吊起來牠全身捲縮,嘴吐絲將自家吊起來厥圓身跔跔,zhoi53 tu31 sii33 ziong33 ci33 ga33 diau53 ki31 loi113 gia33 rhen113 shin33 giu33 giu33,,
DF206K2002_043.wav,藏到蟲繭裡包緊緊的像睡著似的,囥入蠶包肚包緊像睡撇个樣,kong53 ngib54 cam113 bau33 du31 bau33 gin31 ciong53 shoi53 ped21 gai33 rhong53,,
DF206K2002_044.wav,過了大約十天蟲繭變顏色像變魔術一樣,過成十日蠶包變色像變奇術个樣,go53 shang113 shib54 ngid21 cam113 bau33 bien53 sed21 ciong53 bien53 ki113 sud54 gai33 rhong53,,
DF206K2002_045.wav,毛毛蟲從繭裡鑽出來囉,㸐毛蟲對蠶包肚鑽出來哩*喲,nad21 mo33 chung113 dui53 cam113 bau33 du31 zon53 chud21 loi113 li33 *io33 lio33,,
DF206K2002_046.wav,不過濕濕又皺巴巴的翅膀還沒乾,毋過溼溼皺膣郎當个翼還吂燥,m113 go53 shib21 shib21 ziu53 zhi33 long113 dong33 gai33 rhid54 han113 mang113 zau33,,
DF206K2002_047.wav,牠穩穩當當妥妥貼貼很有耐心的等待,佢定貼定貼已有耐心在等,gi113 tin53 tiab54 tin53 tiab54 i53 rhiu33 nai53 sim33 to33 den31,,
DF206K2002_048.wav,真的是俗語說的甘蔗吃一節再一節,正經係往語講个甘蔗食撇一目正一目,zhin53 gin33 he53 gong33 ngi33 gong31 gai33 gam33 zha53 shid54 ped21 rhid21 mug21 zhang33 rhid21 mug21,,
DF206K2002_049.wav,不可以一步登天看著這漂漂亮亮花仙子,毋好打卵斯愛見黃看著這靚妮妮个花仙子,m113 ho31 da31 lon31 sii33 oi53 gien53 vong113 kon53 do31 lia31 ziang33 nid21 nid21 gai33 fa33 sien33 zii31,,
DF206K2002_050.wav,就像是跟我們說人生的許多道理啊,斯親像同𫣆等講人生當多道理啊,sii33 cin33 ciong53 tung113 en33 nen35 gong31 ngin113 sen33 dong33 do33 to53 li33 a31,,
DF206K2002_051.wav,火雞咕嚕咕嚕咕嚕咕嚕園子裡的火雞,火雞咕嚕咕嚕咕嚕咕嚕園肚个火雞,fo31 gie33 gu33 lu33 gu33 lu53 gu33 lu33 gu33 lu53 rhen113 du31 gai33 fo31 gie33,,
DF206K2002_052.wav,看到我們這些小孩撐開像扇子一樣的尾翼,看著吾這兜細孲撐開像扇恁靚个尾翼,kon53 do31 nga33 lia31 deu33 se53 o113 cang53 koi33 ciong53 shen53 an31 ziang33 gai33 mui33 rhid54,,
DF206K2002_053.wav,兩隻腳踢啊踢的走著過來,兩隻腳踢啊踢行緊過來,liong31 zhag21 giog21 ted21 a33 ted21 hang113 gin31 go53 loi113,,
DF206K2002_054.wav,一邊走喉嚨還咕嚕咕嚕一直叫,緊行喉嗹還咕嚕咕嚕緊叫,gin31 hang113 heu113 len113 han113 gu33 lu33 gu33 lu53 gin31 giau53,,
DF206K2002_055.wav,下巴那一塊紅紅皺皺的皮,蛤蟆胲該垤紅紅皺皺个火雞胲,ha113 ma113 goi33 gai53 de53 fung113 fung113 ziu53 ziu53 gai33 fo31 gie33 goi33,,
DF206K2002_056.wav,跟著叫聲曳引抖動看到實在令人害怕,跈核叫聲顫顫掣掣看著實在斯得人畏,ten113 hed54 giau53 shang33 zhun33 zhun33 ched21 ched21 kon53 do31 shid54 cai53 sii33 ded21 ngin113 vui53,,
DF206K2002_057.wav,分不清楚牠是歡迎我們還是抗議我們太吵,分毋清佢係歡迎吾這兜抑係抗議吾等忒吵,fun33 m113 cin33 gi113 he53 fan33 ngiang113 nga33 lia31 deu33 rha33 he53 kong31 ngi53 nga33 nen35 ted21 cau113,,
DF206K2002_058.wav,看牠這樣臉紅紅眼睛盯著看尖尖的嘴喙又像關刀,看佢恁泥面紅紅眼視視尖尖个觜又像關刀,kon53 gi113 an31 ne113 mien53 fung113 fung113 ngien31 shi53 shi53 ziam33 ziam33 gai33 zui31 rhiu53 ciong53 guan33 do33,,
DF206K2002_059.wav,隨時要劈過來的樣子這情勢我看不要惹牠有比較好,隨時愛劈過來个樣相這勢面𠊎看莫惹佢有較贏,sui113 shi113 oi33 piag21 go53 loi113 gai33 rhong53 siong53 lia31 shi53 mien53 ngai113 kon53 mog54 ngia33 gi113 rhiu33 ka33 rhang113,,
DF206K2002_060.wav,還記得那一年回外婆家一下車,還記得該年轉外阿婆屋家一落車,han113 gi53 ded21 gai53 ngien113 zhon31 nguai53 a33 po113 vug21 ka33 rhid21 log54 cha33,,
DF206K2002_061.wav,等不及爸爸媽媽提好伴手禮就一路衝進三合院去找外婆,毋赴等阿爸阿姆擐好等路斯傱緊入伙房屋去尋外阿婆,m113 fu53 den31 a33 ba33 a33 me33 kuan53 ho31 den31 lu53 sii33 zong113 gin31 ngib54 fo31 fong113 vug21 ki53 cim113 nguai53 a33 po113,,
DF206K2002_062.wav,沒有找到外婆卻惹到在屋角邊休息的兩隻大火雞,外阿婆無尋著嗄來惹著屋角歇睏个兩隻大火雞,nguai53 a33 po113 mo113 cim113 do31 sa53 loi113 ngia33 do31 vug21 gog21 hied21 kun53 gai33 liong31 zhag21 tai53 fo31 gie33,,
DF206K2002_063.wav,一直以為像奶奶養的那隻黑狗一樣這麼溫馴,緊恅著像阿婆畜个該隻烏狗共樣恁溫馴,gin31 lau31 do31 ciong53 a33 po113 hiug21 gai33 gai53 zhag21 vu33 gieu31 kiung53 rhong53 an31 vun33 shun113,,
DF206K2002_064.wav,聞得出我的味道就沒有多加注意,鼻得出吾个味瑞斯無加注意佢,pi53 ded21 chud21 nga33 gai33 mui53 sui53 sii33 mo113 ga33 zhu53 rhi53 gi113,,
DF206K2002_065.wav,沒想到那火雞咕嚕咕嚕就衝過來了,無想著該火雞咕嚕咕嚕斯咈緊來咧,mo113 siong31 do31 gai53 fo31 gie33 gu33 lu33 gu33 lu53 sii33 fud54 gin31 loi113 le33,,
DF206K2002_066.wav,兩隻大火雞一起對我飛奔過來才剛看到牠們下巴的紅肉,兩隻大火雞齊齊對𠊎飆過來正看著厥等蛤蟆胲个紅肉,liong31 zhag21 tai53 fo31 gie33 ce113 ce113 dui53 ngai113 biau33 go53 loi113 zhang53 kon53 do31 gia33 nen35 ha113 ma113 goi33 gai33 fung113 ngiug21,,
DF206K2002_067.wav,晃啊晃的一轉頭屁股就被牠啄到了,晃啊晃斡頭屎胐斯畀觜著咧,gong113 a33 gong113 vad21 teu113 shi53 vud21 sii33 bi113 zui31 do31 le33,,
DF206K2002_068.wav,我的媽呀我拚著命往外衝出去,阿姆哀喲𠊎拚緊走往出,a33 me33 oi33 io31 ngai113 biang53 gin31 zeu31 gong33 chud21,,
DF206K2002_069.wav,哪裡知道那隻火雞看我好欺負,吂知該火雞看𠊎好欺負,mang113 di33 gai53 fo31 gie33 kon53 ngai113 ho31 ki33 fu53,,
DF206K2002_070.wav,也追著過來媽我放聲大哭叫媽媽,也逐緊來媽𠊎放聲噭咻阿姆,rha33 giug21 gin31 loi113 ma33 ngai113 biong53 shang33 gieu53 hiu33 a33 me33,,
DF206K2002_071.wav,爸爸從地上抓起一枝竹子就打了過來,阿爸對地泥下挱著一支竹斯𢫦過來,a33 ba33 dui53 ti53 ne113 ha33 sa33 do31 rhid21 gi33 zhug21 sii33 mag54 go53 loi113,,
DF206K2002_072.wav,兩隻火雞咕嚕咕嚕很不甘心的樣子,兩隻火雞咕嚕咕嚕真毋甘願个樣,liong31 zhag21 fo31 gie33 gu33 lu33 gu33 lu53 zhin33 m113 gam33 ngien53 gai33 rhong53,,
DF206K2002_073.wav,眼睜睜的盯著我看走到牆角邊尖尖的嘴喙還咕嚕咕嚕叫不停,目豺豺走到牆頭脣尖尖个觜還咕嚕咕嚕叫無停,mug21 sai113 sai113 zeu31 do53 ciong113 teu113 shun113 ziam33 ziam33 gai33 zui31 han113 gu33 lu33 gu33 lu53 giau53 mo113 tin113,,
DF206K2002_074.wav,在屋後工作的外婆聽到我拼命似的哭聲,屋背做事个外阿婆聽著𠊎放命个噭聲,vug21 boi53 zo53 she53 gai33 nguai53 a33 po113 ten33 do31 ngai113 biong53 miang53 gai33 gieu53 shang33,,
DF206K2002_075.wav,一跑出來看到這情景趕快緊緊把我抱住說,走啊出來看著這光景遽遽同𠊎揇緪緪講,zeu31 a33 chud21 loi113 kon53 do31 lia31 gong33 gin31 giag21 giag21 tung113 ngai113 nam31 hen113 hen113 gong31,,
DF206K2002_076.wav,不用怕不用怕是隻牲畜罷了,毋使驚毋使驚該頭牲得,m113 sii31 giang33 m113 sii31 giang33 gai53 teu113 sang33 ded21,,
DF206K2002_077.wav,還說這短命的火雞竟敢欺負我孫女,還講這火雞恁夭壽敢咈吾孫女,han113 gong31 lia31 fo31 gie33 an31 rheu33 shiu53 gam31 fud54 nga33 sun33 ng31,,
DF206K2002_078.wav,明天把牠殺了給你吃,天光同佢㓾撇分你食,tien33 gong35 tung113 gi113 chi113 ped21 bun33 hn113 shid54,,
DF206K2002_079.wav,邊說邊笑也不知道她是真的生氣還是假裝生氣,緊講緊笑乜毋知佢係正經譴抑係詐意譴,gin31 gong31 gin31 siau53 me33 m113 di33 gi113 he53 zhin53 gin33 kien31 rha33 he53 za53 rhi53 kien31,,
DF206K2002_080.wav,那時候的我只知道那兩隻火雞該死了,該當時个𠊎總知講該兩隻火雞會無命咧,gai53 dong33 shi113 gai33 ngai113 zung31 di33 gong31 gai53 liong31 zhag21 fo31 gie33 voi33 mo113 miang53 le33,,
DF206K2002_081.wav,自從那次的事情之後我每次看到火雞心裡面就先害怕,自該擺个事件過後𠊎見看著火雞心肝肚斯先驚便,cii53 gai53 bai31 gai33 sii53 kien53 go53 heu53 ngai113 gien53 kon53 do31 fo31 gie33 sim33 gon33 du31 sii33 sien33 giang33 pien53,,
DF206K2002_082.wav,閃牠閃得遠遠的今天跟著老師來休閒農場遊玩,閃佢離離今晡日跈先生來休閒農場遶尞,sham31 gi113 li53 li53 gim33 bi33 ngid21 ten113 sin33 sen33 loi113 hiu33 han113 nung113 chong113 lau33 liau53,,
DF206K2002_083.wav,遠遠看到火雞還是一個怕字,遠遠看著火雞還係一隻驚字,rhen31 rhen31 kon53 do31 fo31 gie33 han113 he53 rhid21 zhag21 giang33 sii53,,
DF206K2002_084.wav,屁股揉啊揉的那年的驚險一幕就像昨天才剛發生一樣,屎胐挲啊挲該年个驚險一幕還像昨晡日正發生个樣相,shi53 vud21 so33 a33 so33 gai53 ngien113 gai33 giang33 hiam31 rhid21 mug21 han113 ciong53 ca113 bi33 ngid21 zhang53 fad21 sen33 gai33 rhong53 siong53,,音檔發~驚gin33險
DF206K2002_085.wav,怕牠又不聲不響的衝過來我不敢靠近,驚佢又過恬恬咈來𠊎毋敢行偎,giang33 gi113 rhiu53 go53 diam33 diam33 fud54 loi113 ngai113 m113 gam31 hang113 va31,,
